{
  "$schema": "https://json-schema.org/draft/2020-12/schema",
  "$id": "https://as-driven.example/schema/v1/car-record.schema.json",
  "title": "As Driven car record",
  "type": "object",
  "additionalProperties": false,
  "required": [
    "$schema",
    "schema_version",
    "record_id",
    "identity",
    "authentic_controls",
    "simulators",
    "provenance",
    "updated_at"
  ],
  "properties": {
    "$schema": { "type": "string" },
    "schema_version": { "const": "1.0.0" },
    "record_id": { "$ref": "#/$defs/id" },
    "identity": { "$ref": "#/$defs/identity" },
    "authentic_controls": { "$ref": "#/$defs/controls" },
    "simulators": {
      "type": "array",
      "minItems": 1,
      "items": { "$ref": "#/$defs/simulatorEntry" }
    },
    "provenance": { "$ref": "#/$defs/provenance" },
    "driver_summary": {
      "description": "One short paragraph adding useful car-specific design, history, competition or class-era context, or relevant instructive technique beyond the Fit and Use rows. Generic simulator classes may share supported category and era context without claiming an exact real chassis. Optional when no supported useful information is available. Every material claim must be supported by the record values or cited sources; do not pad with row restatement or research-status caveats.",
      "type": "string",
      "minLength": 1,
      "maxLength": 520
    },
    "archetype": { "$ref": "#/$defs/archetypeClassification" },
    "notes": { "type": "array", "items": { "type": "string" } },
    "updated_at": { "$ref": "#/$defs/date" }
  },
  "$defs": {
    "id": {
      "type": "string",
      "pattern": "^[a-z0-9]+(?:[._-][a-z0-9]+)*$"
    },
    "date": { "type": "string", "format": "date" },
    "state": {
      "type": "string",
      "enum": ["yes", "no", "unknown", "not-applicable"]
    },
    "confidenceLevel": {
      "type": "string",
      "enum": ["verified", "high", "medium", "low", "unknown"]
    },
    "confidence": {
      "type": "object",
      "additionalProperties": false,
      "required": ["level", "basis"],
      "properties": {
        "level": { "$ref": "#/$defs/confidenceLevel" },
        "basis": { "type": "string", "minLength": 1 }
      }
    },
    "archetypeClassification": {
      "description": "Which control archetype this record's transmission matches, declared by a reviewer and never derived by tooling. Optional: a record without it is unreviewed for archetype, which is different from one reviewed and found to match none. The archetype supplies no values - authentic_controls.transmission stays the authoritative, fully written-out description of the car - so this block can only ever describe the record, never change it. It is a curation and review aid and carries no evidence: it must never appear in a provenance claim or a source reference. See docs/archetypes.md.",
      "type": "object",
      "additionalProperties": false,
      "required": ["classification"],
      "properties": {
        "archetype_id": {
          "description": "The archetype in data/v1/archetypes.json. Required when classification is matches or deviates, and must be absent otherwise.",
          "$ref": "#/$defs/id"
        },
        "classification": {
          "description": "matches - every field equals the archetype. deviates - the record departs from it in the declared ways, and nowhere else. no-archetype - reviewed, and this mechanism genuinely matches none. undetermined - cannot be classified yet, because an unknown sits in a field that separates two or more archetypes. The last two mirror the no/unknown distinction the rest of the dataset draws: one is a conclusion, the other is a gap, and collapsing them would lose the reason to drive the car again.",
          "type": "string",
          "enum": ["matches", "deviates", "no-archetype", "undetermined"]
        },
        "deviations": {
          "description": "Every field where the record departs from its archetype, each declared with a reason. Required and non-empty when classification is deviates, and empty or absent otherwise. A departure the record does not declare is a validation failure, which is what keeps an unintended change loud rather than letting it pass as one more record that happens to differ.",
          "type": "array",
          "items": {
            "type": "object",
            "additionalProperties": false,
            "required": ["path", "basis"],
            "properties": {
              "path": {
                "description": "JSON Pointer to the departing field, inside this record's transmission block.",
                "type": "string",
                "pattern": "^/authentic_controls/transmission(/[^/]+)+$"
              },
              "basis": {
                "description": "Why this car departs. The departure is usually the research finding, so this line is the one a reviewer reads first.",
                "type": "string",
                "minLength": 1
              }
            }
          }
        },
        "basis": {
          "description": "Why this classification was reached. Required when classification is no-archetype or undetermined, where nothing else records the reviewer's reasoning. For undetermined, name the field whose unknown blocks the decision: that is what a future drive has to settle.",
          "type": "string",
          "minLength": 1
        }
      }
    },
    "identity": {
      "type": "object",
      "additionalProperties": false,
      "required": ["display_name", "manufacturer", "model", "year", "class"],
      "properties": {
        "display_name": { "type": "string", "minLength": 1 },
        "manufacturer": { "type": "string", "minLength": 1 },
        "model": { "type": "string", "minLength": 1 },
        "variant": { "type": "string" },
        "year": {
          "type": "object",
          "additionalProperties": false,
          "required": ["label"],
          "properties": {
            "from": { "type": "integer", "minimum": 1885, "maximum": 2200 },
            "to": { "type": "integer", "minimum": 1885, "maximum": 2200 },
            "label": { "type": "string", "minLength": 1 }
          }
        },
        "class": { "type": "string", "minLength": 1 },
        "additional_classes": {
          "description": "Further real-world categories the same car competes in, where one car carries more than one category name: a Porsche 963 is GTP in IMSA and Hypercar in the WEC. `class` stays the primary category so existing consumers keep working.",
          "type": "array",
          "uniqueItems": true,
          "items": { "type": "string", "minLength": 1 }
        },
        "real_world_identity_notes": { "type": "string" }
      }
    },
    "shiftAction": {
      "type": "object",
      "additionalProperties": false,
      "required": ["clutch", "throttle_lift", "automatic_cut", "manual_blip", "automatic_blip"],
      "properties": {
        "clutch": {
          "type": "string",
          "enum": ["required", "not-required", "optional", "unknown", "not-applicable"]
        },
        "throttle_lift": {
          "type": "string",
          "enum": ["required", "not-required", "partial", "unknown", "not-applicable"]
        },
        "automatic_cut": { "$ref": "#/$defs/state" },
        "manual_blip": {
          "type": "string",
          "enum": ["required", "not-required", "optional", "unknown", "not-applicable"]
        },
        "automatic_blip": { "$ref": "#/$defs/state" }
      }
    },
    "transmission": {
      "type": "object",
      "additionalProperties": false,
      "required": ["forward_gears", "gearbox_type", "shift_actuation", "shift_pattern", "upshift", "downshift", "standing_start_clutch"],
      "properties": {
        "forward_gears": { "type": ["integer", "null"], "minimum": 1, "maximum": 20 },
        "gearbox_type": {
          "type": "string",
          "enum": [
            "synchromesh",
            "dogbox",
            "sequential",
            "semi-automatic",
            "dual-clutch",
            "automatic",
            "direct-drive",
            "unknown"
          ]
        },
        "shift_actuation": {
          "type": "string",
          "enum": [
            "h-pattern",
            "sequential-stick",
            "sequential-paddles",
            "automatic-lever",
            "direct-selection",
            "unknown"
          ]
        },
        "shift_pattern": {
          "type": "string",
          "enum": ["standard-h", "dogleg-h", "sequential", "automatic-gate", "direct", "unknown"]
        },
        "first_gear_position": {
          "description": "Where first gear sits in the gate. A dogleg pattern only states that first is outside the racing plane; it does not establish which side, and at least one car mirrors it.",
          "type": ["string", "null"],
          "enum": ["up-left", "up-right", "down-left", "down-right", "unknown", null]
        },
        "upshift": { "$ref": "#/$defs/shiftAction" },
        "downshift": { "$ref": "#/$defs/shiftAction" },
        "standing_start_clutch": {
          "type": "string",
          "enum": ["required", "not-required", "anti-stall-available", "unknown", "not-applicable"]
        }
      }
    },
    "steering": {
      "type": "object",
      "additionalProperties": false,
      "required": ["wheel_rim"],
      "properties": {
        "degrees_of_rotation": { "type": "integer", "minimum": 90, "maximum": 1800 },
        "wheel_rim": {
          "type": "object",
          "additionalProperties": false,
          "required": ["shape", "source_label"],
          "properties": {
            "shape": {
              "description": "Rim family, based on the physical control the driver holds. Use gt-formula for fixed molded grips around a central control face, round for a conventional generally circular rim, d-shaped for a conventional rim with a flattened section, and unknown when the rim was not seen. gt-style, formula, prototype, yoke, and other are deprecated legacy values. They remain in the enum for old artifacts but must not be used for curated records.",
              "type": "string",
              "enum": ["round", "d-shaped", "gt-formula", "gt-style", "prototype", "formula", "yoke", "other", "unknown"]
            },
            "diameter_mm": { "type": ["integer", "null"], "minimum": 150, "maximum": 600 },
            "integrated_display": {
              "description": "Whether the rim itself carries a readout: a graphical LCD, an LED numeric gear indicator, or a segment display all count. A dash mounted on the car rather than the rim does not, and shift lights alone do not.",
              "$ref": "#/$defs/state"
            },
            "shift_lights": {
              "description": "Whether the rim carries shift or rev lights, recorded independently of integrated_display.",
              "$ref": "#/$defs/state"
            },
            "open_top": {
              "description": "For a conventional round or d-shaped rim, whether an upper section of the rim is removed. Use not-applicable for gt-formula because its fixed-grip control-face construction already determines the hardware choice. Do not use this field to distinguish varieties of GT or Formula wheels.",
              "$ref": "#/$defs/state"
            },
            "source_label": { "type": "string" },
            "notes": { "type": "string" }
          }
        }
      }
    },
    "controls": {
      "type": "object",
      "additionalProperties": false,
      "required": ["transmission", "steering"],
      "properties": {
        "transmission": { "$ref": "#/$defs/transmission" },
        "steering": { "$ref": "#/$defs/steering" },
        "notes": { "type": "array", "items": { "type": "string" } }
      }
    },
    "aeroPackage": {
      "description": "An aero configuration a simulator selects from the circuit rather than from the driver. The vocabulary is closed: these are the only packages any curated simulator applies, and a name-shaped identity carries at most one of them.",
      "type": "string",
      "enum": ["base", "high-downforce", "low-downforce", "speedway", "superspeedway"]
    },
    "simulatorIdentity": {
      "type": "object",
      "additionalProperties": false,
      "required": ["kind", "value"],
      "properties": {
        "kind": {
          "type": "string",
          "enum": ["display-name", "telemetry-name", "internal-id", "car-path", "class-id", "alias"]
        },
        "value": {
          "description": "The exact string the simulator reports. Where aero_packages is present this is the base name with no package suffix, and the suffixed forms are derived from it; everywhere else it is the whole identity, written out.",
          "type": "string",
          "minLength": 1
        },
        "aero_packages": {
          "description": "The aero configurations this identity covers, expanded into one exact lookup key each when the database is loaded. It replaces writing every suffixed spelling by hand: 164 of 404 curated telemetry names were a base name plus one of four suffixes, and 42 of those were never observed at all but derived by a reviewer and marked as such.\n\nThis is not fuzzy matching and does not relax exact matching. Expansion produces exact strings and nothing is rewritten at match time, so an identity a record does not declare still fails to match, still logs as unmatched, and still shows the driver a blank card rather than another car's answer. The failure mode stays what it is today.\n\nHow a package renders is a property of the simulator, not of the record: AMS2 appends ' - High Downforce' and its siblings to the base name, and renders `base` as the bare name. A simulator that names its variants unsystematically declares nothing here and writes its identities out literally, exactly as every record does today.\n\nOnly a telemetry-name may carry this, and the packages a car offers differ by class and must be read per class rather than assumed from another car: two of the AMS2 open-wheel classes offer no low-downforce package at all.",
          "type": "array",
          "minItems": 1,
          "uniqueItems": true,
          "items": { "$ref": "#/$defs/aeroPackage" }
        }
      }
    },
    "simBehavior": {
      "type": "object",
      "additionalProperties": false,
      "required": ["shift_type", "auto_blip", "shift_cut", "wheel_rim_type"],
      "properties": {
        "shift_type": { "type": "string", "minLength": 1 },
        "auto_blip": { "$ref": "#/$defs/state" },
        "shift_cut": { "$ref": "#/$defs/state" },
        "steering_dor": { "type": "integer", "minimum": 90, "maximum": 1800 },
        "wheel_rim_type": {
          "type": "object",
          "additionalProperties": false,
          "required": ["normalized", "source_label"],
          "properties": {
            "normalized": {
              "description": "Rim family, based on the physical control the driver holds. Use gt-formula for fixed molded grips around a central control face, round for a conventional generally circular rim, d-shaped for a conventional rim with a flattened section, and unknown when the rim was not seen. gt-style, formula, prototype, yoke, and other are deprecated legacy values. They remain in the enum for old artifacts but must not be used for curated records.",
              "type": "string",
              "enum": ["round", "d-shaped", "gt-formula", "gt-style", "prototype", "formula", "yoke", "other", "unknown"]
            },
            "integrated_display": {
              "description": "Whether the rim itself carries a readout: a graphical LCD, an LED numeric gear indicator, or a segment display all count. A dash mounted on the car rather than the rim does not, and shift lights alone do not.",
              "$ref": "#/$defs/state"
            },
            "shift_lights": {
              "description": "Whether the rim carries shift or rev lights, recorded independently of integrated_display.",
              "$ref": "#/$defs/state"
            },
            "open_top": {
              "description": "For a conventional round or d-shaped rim, whether an upper section of the rim is removed. Use not-applicable for gt-formula because its fixed-grip control-face construction already determines the hardware choice. Do not use this field to distinguish varieties of GT or Formula wheels.",
              "$ref": "#/$defs/state"
            },
            "source_label": { "type": "string" }
          }
        },
        "notes": { "type": "array", "items": { "type": "string" } }
      }
    },
    "override": {
      "type": "object",
      "additionalProperties": false,
      "required": ["path", "value", "condition", "source_refs", "confidence"],
      "properties": {
        "path": { "type": "string", "pattern": "^/" },
        "value": {},
        "condition": { "type": "string", "minLength": 1 },
        "source_refs": {
          "type": "array",
          "minItems": 1,
          "uniqueItems": true,
          "items": { "$ref": "#/$defs/id" }
        },
        "confidence": { "$ref": "#/$defs/confidence" }
      }
    },
    "simulatorEntry": {
      "type": "object",
      "additionalProperties": false,
      "required": [
        "simulator",
        "identities",
        "behavior",
        "overrides",
        "verified_game_version",
        "verified_at",
        "source_refs",
        "confidence"
      ],
      "properties": {
        "simulator": {
          "type": "string",
          "enum": ["ams1", "ams2", "iracing", "ac", "acc", "ac-evo", "ac-rally", "raceroom", "rfactor2", "pmr", "gtr2", "other"]
        },
        "display_name": {
          "description": "What this simulator calls the car, where that differs from the record's name. A renamed car is named differently by each game that renames it: the Prodrive Ferrari 550 is Milano GT55 in AMS2 and GT Ferruccio 55 V12 in Assetto Corsa. Absent means the record's own display_name is what this simulator shows.",
          "type": "string",
          "minLength": 1
        },
        "class": {
          "description": "What this simulator calls the class, where that differs from the record's category. A simulator that states no class of its own shows none.",
          "type": "string",
          "minLength": 1
        },
        "identities": {
          "type": "array",
          "minItems": 1,
          "items": { "$ref": "#/$defs/simulatorIdentity" }
        },
        "behavior": { "$ref": "#/$defs/simBehavior" },
        "overrides": { "type": "array", "items": { "$ref": "#/$defs/override" } },
        "verified_game_version": { "type": "string", "minLength": 1, "not": { "const": "latest" } },
        "verified_at": { "$ref": "#/$defs/date" },
        "source_refs": {
          "type": "array",
          "minItems": 1,
          "uniqueItems": true,
          "items": { "$ref": "#/$defs/id" }
        },
        "confidence": { "$ref": "#/$defs/confidence" }
      }
    },
    "claim": {
      "type": "object",
      "additionalProperties": false,
      "required": ["paths", "source_refs", "confidence", "basis"],
      "properties": {
        "paths": {
          "type": "array",
          "minItems": 1,
          "uniqueItems": true,
          "items": { "type": "string", "pattern": "^/" }
        },
        "source_refs": {
          "type": "array",
          "minItems": 1,
          "uniqueItems": true,
          "items": { "$ref": "#/$defs/id" }
        },
        "confidence": { "$ref": "#/$defs/confidenceLevel" },
        "basis": { "type": "string", "minLength": 1 }
      }
    },
    "provenance": {
      "type": "object",
      "additionalProperties": false,
      "required": ["claims"],
      "properties": {
        "claims": { "type": "array", "minItems": 1, "items": { "$ref": "#/$defs/claim" } }
      }
    }
  }
}
