{
  "$schema": "../../../schema/v1/car-record.schema.json",
  "schema_version": "1.0.0",
  "record_id": "ams2.formula-v10-g2",
  "identity": {
    "display_name": "Formula V10 G2",
    "manufacturer": "Reiza",
    "model": "Formula V10",
    "year": {
      "label": "2000",
      "from": 2000,
      "to": 2000
    },
    "class": "Formula V10 G2",
    "real_world_identity_notes": "AMS2 fictional Formula V10 second-generation identity; the source uses G2 while current SimHub telemetry uses Gen2.",
    "variant": "Gen2"
  },
  "authentic_controls": {
    "transmission": {
      "forward_gears": 7,
      "gearbox_type": "sequential",
      "shift_actuation": "sequential-paddles",
      "shift_pattern": "sequential",
      "upshift": {
        "clutch": "not-required",
        "throttle_lift": "not-required",
        "automatic_cut": "yes",
        "manual_blip": "not-applicable",
        "automatic_blip": "not-applicable"
      },
      "downshift": {
        "clutch": "not-required",
        "throttle_lift": "not-applicable",
        "automatic_cut": "not-applicable",
        "manual_blip": "not-required",
        "automatic_blip": "yes"
      },
      "standing_start_clutch": "not-required"
    },
    "steering": {
      "wheel_rim": {
        "shape": "gt-formula",
        "source_label": "live-cockpit-formula",
        "notes": "Direct cockpit inspection established the rim category and display, shift-light, and open-top details.",
        "diameter_mm": null,
        "integrated_display": "yes",
        "shift_lights": "yes",
        "open_top": "no"
      }
    },
    "notes": [
      "Current guided AMS2 testing established move-off, running-shift technique, and cockpit controls with simulator assists disabled.",
      "The modeled car moves from rest without physical clutch input.",
      "The steering lock came from the AMS2 spreadsheet, which records what the simulator applies rather than what the real car was built with. It moves to the simulator layer, where that evidence belongs; no reviewed source establishes the real car's lock.",
      "This record came from the original AMS2 spreadsheet import, where one claim covered the identity, the whole of authentic_controls and the simulator behaviour together. The car has since been driven, and the guided observation establishes those controls directly. The spreadsheet claim no longer reaches authentic_controls, because it describes what the simulator models and cannot settle what the real car had."
    ]
  },
  "simulators": [
    {
      "simulator": "ams2",
      "identities": [
        {
          "kind": "telemetry-name",
          "value": "Formula V10 Gen2 (B) - High Downforce"
        },
        {
          "kind": "telemetry-name",
          "value": "Formula V10 Gen2 (M) - High Downforce"
        },
        {
          "kind": "internal-id",
          "value": "Formula V10 Gen2 (B) - High Downforce"
        },
        {
          "kind": "class-id",
          "value": "F-V10_Gen2_HD"
        },
        {
          "kind": "telemetry-name",
          "value": "Formula V10 Gen2 (B)"
        },
        {
          "kind": "telemetry-name",
          "value": "Formula V10 Gen2 (B) - Low Downforce"
        },
        {
          "kind": "telemetry-name",
          "value": "Formula V10 Gen2 (M)"
        },
        {
          "kind": "telemetry-name",
          "value": "Formula V10 Gen2 (M) - Low Downforce"
        }
      ],
      "behavior": {
        "shift_type": "sequential-paddles",
        "auto_blip": "yes",
        "shift_cut": "yes",
        "wheel_rim_type": {
          "normalized": "gt-formula",
          "integrated_display": "yes",
          "shift_lights": "yes",
          "open_top": "no",
          "source_label": "live-cockpit-formula"
        },
        "notes": [
          "Guided current-game testing directly established all user-facing controls."
        ],
        "steering_dor": 450
      },
      "overrides": [],
      "verified_game_version": "1.6.9.91",
      "verified_at": "2026-08-12",
      "source_refs": [
        "ams2.coanda-sheet.v1.0.34",
        "ams2.reiza-forum.extended-car-info",
        "simhub.local-ams2-identities.9.11.22",
        "simhub.local-live-ams2-identities.1.6.9.91",
        "ams2.local-live-formula-v10-g2-controls.1.6.9.91"
      ],
      "confidence": {
        "level": "verified",
        "basis": "Exact current-game identity, driving technique, and cockpit controls were directly tested through the guided workflow."
      }
    }
  ],
  "provenance": {
    "claims": [
      {
        "paths": [
          "/identity",
          "/simulators/0/behavior"
        ],
        "source_refs": [
          "ams2.coanda-sheet.v1.0.34",
          "ams2.reiza-forum.extended-car-info"
        ],
        "confidence": "medium",
        "basis": "Conservative promotion of AMS2 sheet row 122 with unsupported technique left unknown."
      },
      {
        "paths": [
          "/simulators/0/identities/0"
        ],
        "source_refs": [
          "simhub.local-ams2-identities.9.11.22"
        ],
        "confidence": "verified",
        "basis": "SimHub observes Formula V10 Gen2; the source name and class identify Formula V10 G2, with the G2/Gen2 generation equivalence explicitly reviewed."
      },
      {
        "paths": [
          "/simulators/0/identities/2",
          "/simulators/0/identities/3"
        ],
        "source_refs": [
          "simhub.local-live-ams2-identities.1.6.9.91"
        ],
        "confidence": "verified",
        "basis": "AMS2 1.6.9.91 emitted the exact B- and M-tyre High Downforce telemetry identities during live local tests. Both are explicitly reviewed configuration variants of Formula V10 Gen2."
      },
      {
        "paths": [
          "/authentic_controls/transmission",
          "/authentic_controls/steering/wheel_rim",
          "/simulators/0/identities",
          "/simulators/0/behavior"
        ],
        "source_refs": [
          "ams2.local-live-formula-v10-g2-controls.1.6.9.91"
        ],
        "confidence": "verified",
        "basis": "Reviewed guided observation of the exact AMS2 1.6.9.91 identity; draft hash 522a88aa."
      }
    ]
  },
  "notes": [
    "The wheel-rim shape was originally recorded as \"formula\". The separate \"gt-style\", \"formula\" and \"prototype\" values described the same rim: molded grips at 9 and 3 with a control face between them, usually carrying a display and rev lights. They are merged into \"gt-formula\". The rim was not observed again and nothing about the observation changed."
  ],
  "updated_at": "2026-08-16"
}
